"","Package","Item","Title","Dim","dim","nrow","ncol"
"610","openintro","tips","Tip data","95x5",2,95,5
"611","openintro","unemploy_pres","President's party performance and unemployment rate","29x5",2,29,5
"612","pbkrtest","beets","Sugar beets data","30x5",2,30,5
"613","reshape2","smiths","Demo data describing the Smiths.","2x5",2,2,5
"614","RobStatTM","neuralgia","Neuralgia data","18x5",2,18,5
"615","RobStatTM","stackloss","Stackloss data","21x5",2,21,5
"616","robustbase","aircraft","Aircraft Data","23x5",2,23,5
"617","robustbase","bushfire","Campbell Bushfire Data","38x5",2,38,5
"618","robustbase","radarImage","Satellite Radar Image Data from near Munich","1573x5",2,1573,5
"619","rpart","cu.summary","Automobile Data from 'Consumer Reports' 1990","117x5",2,117,5
"620","tidyr","cms_patient_care","Data from the Centers for Medicare & Medicaid Services","252x5",2,252,5
"621","tidyr","cms_patient_experience","Data from the Centers for Medicare & Medicaid Services","500x5",2,500,5
"622","tidyr","household","Household data","5x5",2,5,5
"623","tidyr","smiths","Some data about the Smith family","2x5",2,2,5
"624","tidyr","us_rent_income","US rent and income data","104x5",2,104,5
"625","usdata","pop_age_2019","Population Age 2019 Data.","4386x5",2,4386,5
"626","usdata","urban_rural_pop","State summary info","51x5",2,51,5
"627","usdata","vote_nsa","Predicting who would vote for NSA Mass Surveillance","434x5",2,434,5
"628","vcd","Arthritis","Arthritis Treatment Data","84x5",2,84,5
"629","vcd","Bundestag2005","Votes in German Bundestag Election 2005","16x5",2,16,5
"630","vcd","DanishWelfare","Danish Welfare Study Data","180x5",2,180,5
"631","vcd","HorseKicks","Death by Horse Kicks","5",2,5,5
"632","vcd","JointSports","Opinions About Joint Sports","40x5",2,40,5
"633","vcd","OvaryCancer","Ovary Cancer Data","16x5",2,16,5
"634","vcd","Punishment","Corporal Punishment Data","36x5",2,36,5
"635","vcd","Trucks","Truck Accidents Data","24x5",2,24,5
"636","vcd","UKSoccer","UK Soccer Scores","5x5",2,5,5
"637","bain","kuiper2013","The Effect of Prior Interaction on Trust","4x4",2,4,4
"638","boot","amis","Car Speeding and Warning Signs","8437x4",2,8437,4
"639","boot","beaver","Beaver Body Temperature Data","100x4",2,100,4
"640","boot","frets","Head Dimensions in Brothers","25x4",2,25,4
"641","boot","motor","Data from a Simulated Motorcycle Accident","94x4",2,94,4
"642","boot","salinity","Water Salinity and River Discharge","28x4",2,28,4
"643","ca","smoke","Smoke dataset","5x4",2,5,4
"644","carData","Angell","Moral Integration of American Cities","43x4",2,43,4
"645","carData","Anscombe","U. S. State Public-School Expenditures","51x4",2,51,4
"646","carData","Blackmore","Exercise Histories of Eating-Disordered and Control Subjects","945x4",2,945,4
"647","carData","Cowles","Cowles and Davis's Data on Volunteering","1421x4",2,1421,4
"648","carData","Duncan","Duncan's Occupational Prestige Data","45x4",2,45,4
"649","carData","Freedman","Crowding and Crime in U. S. Metropolitan Areas","110x4",2,110,4
"650","carData","Leinhardt","Data on Infant-Mortality","105x4",2,105,4
"651","carData","Moore","Status, Authoritarianism, and Conformity","45x4",2,45,4
"652","carData","Ornstein","Interlocking Directorates Among Major Canadian Firms","248x4",2,248,4
"653","carData","TitanicSurvival","Survival of Passengers on the Titanic","1309x4",2,1309,4
"654","carData","Vocab","Vocabulary and Education","30351x4",2,30351,4
"655","carData","Womenlf","Canadian Women's Labour-Force Participation","263x4",2,263,4
"656","carData","Wool","Wool data","27x4",2,27,4
"657","cluster","pluton","Isotopic Composition Plutonium Batches","45x4",2,45,4
"658","data2teach","avengers_long","Avengers (death of Comic Characters)","173x4",2,173,4
"659","data2teach","ee_me_eng","","30x4",2,30,4
"660","data2teach","gearbox","","275x4",2,275,4
"661","datasets","ChickWeight","Weight versus age of chicks on different diets","578x4",2,578,4
"662","datasets","EuStockMarkets","Daily Closing Prices of Major European Stock Indices, 1991-1998","1860x4",2,1860,4
"663","datasets","HairEyeColor","Hair and Eye Color of Statistics Students","4x4x2",3,4,4
"664","datasets","OrchardSprays","Potency of Orchard Sprays","64x4",2,64,4
"665","datasets","USArrests","Violent Crime Rates by US State","50x4",2,50,4
"666","datasets","VADeaths","Death Rates in Virginia (1940)","5x4",2,5,4
"667","datasets","iris3","Edgar Anderson's Iris Data","50x4x3",3,50,4
"668","datasets","rock","Measurements on Petroleum Rock Samples","48x4",2,48,4
"669","datasets","stackloss","Brownlee's Stack Loss Plant Data","21x4",2,21,4
"670","DiagrammeR","currencies","ISO-4217 currency data.","171x4",2,171,4
"671","doBy","budworm","Budworm data","12x4",2,12,4
"672","doBy","child_growth","Berkeley Growth Study data","2883x4",2,2883,4
"673","doBy","shoes","shoes","10x4",2,10,4
"674","fivethirtyeight","mediacloud_states","The Media Really Started Paying Attention to Puerto Rico When Trump Did","51x4",2,51,4
"675","fivethirtyeight","nba_draymond","A Better Way to Evaluate NBA Defense","3009x4",2,3009,4
"676","fivethirtyeight","partisan_lean_district","FiveThirtyEight's Partisan Lean","435x4",2,435,4
"677","fivethirtyeight","senate_polls","Early Senate Polls Have Plenty to Tell Us About November","107x4",2,107,4
"678","fivethirtyeight","state_info","Information on each state","51x4",2,51,4
"679","fivethirtyeight","tarantino","A Complete Catalog Of Every Time Someone Cursed Or Bled Out In A Quentin Tarantino Movie","1894x4",2,1894,4
"680","fivethirtyeight","tv_states","The Media Really Started Paying Attention to Puerto Rico When Trump Did","52x4",2,52,4
"681","fivethirtyeight","undefeated","Mayweather Is Defined By The Zero Next To His Name","2125x4",2,2125,4
"682","ggmosaic","titanic","Passengers and crew on board the Titanic","2201x4",2,2201,4
"683","ggplot2","economics_long","US economic time series","2870x4",2,2870,4
"684","ggplot2","luv_colours","'colors()' in Luv space","657x4",2,657,4
"685","ggplot2","presidential","Terms of 12 presidents from Eisenhower to Trump","12x4",2,12,4
"686","ggplot2","seals","Vector field of seal movements","1155x4",2,1155,4
"687","ggridges","Catalan_elections","Results from Catalan regional elections (1980-2015)","20764x4",2,20764,4
"688","lattice","barley","Yield data from a Minnesota barley trial","120x4",2,120,4
"689","lattice","environmental","Atmospheric environmental conditions in New York City","111x4",2,111,4
"690","lme4","Pastes","Paste strength by batch and cask","60x4",2,60,4
"691","lme4","cbpp","Contagious bovine pleuropneumonia","56x4",2,56,4
"692","lmtest","currencysubstitution","Currency Substitution","61x4",2,61,4
"693","lmtest","wages","Wages","20x4",2,20,4
"694","MASS","Sitka","Growth Curves for Sitka Spruce Trees in 1988","395x4",2,395,4
"695","MASS","Sitka89","Growth Curves for Sitka Spruce Trees in 1989","632x4",2,632,4
"696","MASS","Traffic","Effect of Swedish Speed Limits on Accidents","184x4",2,184,4
"697","MASS","beav1","Body Temperature Series of Beaver 1","114x4",2,114,4
"698","MASS","beav2","Body Temperature Series of Beaver 2","100x4",2,100,4
"699","MASS","cabbages","Data from a cabbage field trial","60x4",2,60,4
"700","MASS","coop","Co-operative Trial in Analytical Chemistry","252x4",2,252,4
"701","MASS","farms","Ecological Factors in Farm Management","20x4",2,20,4
"702","MASS","gehan","Remission Times of Leukaemia Patients","42x4",2,42,4
"703","MASS","immer","Yields from a Barley Field Trial","30x4",2,30,4
"704","MASS","npr1","US Naval Petroleum Reserve No. 1 data","104x4",2,104,4
"705","MASS","oats","Data from an Oats Field Trial","72x4",2,72,4
"706","modeldata","two_class_example","Two class predictions","500x4",2,500,4
"707","modelr","sim4","Simple simulated datasets","300x4",2,300,4
"708","nlme","Alfalfa","Split-Plot Experiment on Varieties of Alfalfa","72x4",2,72,4
"709","nlme","Assay","Bioassay on Cell Culture Plate","60x4",2,60,4
"710","nlme","BodyWeight","Rat weight over time for different diets","176x4",2,176,4
"711","nlme","Glucose","Glucose levels over time","378x4",2,378,4
"712","nlme","Glucose2","Glucose Levels Following Alcohol Ingestion","196x4",2,196,4
"713","nlme","Gun","Methods for firing naval guns","36x4",2,36,4
"714","nlme","Meat","Tenderness of meat","30x4",2,30,4
"715","nlme","Milk","Protein content of cows' milk","1337x4",2,1337,4
"716","nlme","Nitrendipene","Assay of nitrendipene","89x4",2,89,4
"717","nlme","Oats","Split-plot Experiment on Varieties of Oats","72x4",2,72,4
"718","nlme","Orthodont","Growth curve data on an orthdontic measurement","108x4",2,108,4
"719","nlme","Oxboys","Heights of Boys in Oxford","234x4",2,234,4
"720","nlme","Pixel","X-ray pixel intensities over time","102x4",2,102,4
"721","nlme","Spruce","Growth of Spruce Trees","1027x4",2,1027,4
"722","nlme","Tetracycline1","Pharmacokinetics of tetracycline","40x4",2,40,4
"723","nlme","Tetracycline2","Pharmacokinetics of tetracycline","40x4",2,40,4
"724","nlme","Wafer","Modeling of Analog MOS Circuits","400x4",2,400,4
"725","nlme","Wheat","Yields by growing conditions","48x4",2,48,4
"726","openintro","cards","Deck of cards","52x4",2,52,4
"727","openintro","country_iso","Country ISO information","249x4",2,249,4
"728","openintro","life_exp","life_exp","3142x4",2,3142,4
"729","openintro","mail_me","Influence of a Good Mood on Helpfulness","42x4",2,42,4
"730","openintro","mlb","Salary data for Major League Baseball (2010)","828x4",2,828,4
"731","openintro","murders","Data for 20 metropolitan areas","20x4",2,20,4
"732","openintro","nba_heights","NBA Player heights from 2008-9","435x4",2,435,4
"733","openintro","orings","1986 Challenger disaster and O-rings","23x4",2,23,4
"734","openintro","stocks_18","Monthly Returns for a few stocks","36x4",2,36,4
"735","pbkrtest","budworm","Budworm data","12x4",2,12,4
"736","probably","species_probs","Predictions on animal species","110x4",2,110,4
"737","RobStatTM","oats","Oats data","40x4",2,40,4
"738","robustbase","NOxEmissions","NOx Air Pollution Data","8088x4",2,8088,4
"739","robustbase","airmay","Air Quality Data","31x4",2,31,4
"740","robustbase","biomassTill","Biomass Tillage Data","58x4",2,58,4
"741","robustbase","carrots","Insect Damages on Carrots","24x4",2,24,4
"742","robustbase","foodstamp","Food Stamp Program Participation","150x4",2,150,4
"743","robustbase","hbk","Hawkins, Bradu, Kass's Artificial Data","75x4",2,75,4
"744","robustbase","salinity","Salinity Data","28x4",2,28,4
"745","rpart","kyphosis","Data on Children who have had Corrective Spinal Surgery","81x4",2,81,4
"746","survival","logan","Data from the 1972-78 GSS data used by Logan","838x4",2,838,4
"747","survminer","BRCAOV.survInfo","Breast and Ovarian Cancers Survival Information","1674x4",2,1674,4
"748","tidyr","table1","Example tabular representations","6x4",2,6,4
"749","tidyr","table2","Example tabular representations","12x4",2,12,4
"750","tidyr","table5","Example tabular representations","6x4",2,6,4
"751","vcd","BrokenMarriage","Broken Marriage Data","20x4",2,20,4
"752","vcd","Hitters","Hitters Data","154x4",2,154,4
"753","vcd","JobSatisfaction","Job Satisfaction Data","8x4",2,8,4
"754","vcd","MSPatients","Diagnosis of Multiple Sclerosis","4x4x2",3,4,4
"755","vcd","NonResponse","Non-Response Survey Data","12x4",2,12,4
"756","vcd","SexualFun","Sex is Fun","4x4",2,4,4
"757","vcd","VisualAcuity","Visual Acuity in Left and Right Eyes","32x4",2,32,4
"758","vcd","VonBort","Von Bortkiewicz Horse Kicks Data","280x4",2,280,4
"759","workflowsets","chi_features_set","Chicago Features Example Data","3x4",2,3,4
"760","workflowsets","two_class_set","Two Class Example Data","6x4",2,6,4
"761","yardstick","two_class_example","Two Class Predictions","500x4",2,500,4
"762","boot","acme","Monthly Excess Returns","60x3",2,60,3
"763","boot","aml","Remission Times for Acute Myelogenous Leukaemia","23x3",2,23,3
"764","boot","brambles","Spatial Location of Bramble Canes","823x3",2,823,3
"765","boot","catsM","Weight Data for Domestic Cats","97x3",2,97,3
"766","boot","downs.bc","Incidence of Down's Syndrome in British Columbia","30x3",2,30,3
"767","boot","fir","Counts of Balsam-fir Seedlings","50x3",2,50,3
"768","boot","hirose","Failure Time of PET Film","44x3",2,44,3
"769","boot","poisons","Animal Survival Times","48x3",2,48,3
"770","boot","remission","Cancer Remission and Cell Activity","27x3",2,27,3
"771","carData","Adler","Experimenter Expectations","108x3",2,108,3
"772","carData","Burt","Fraudulent Data on IQs of Twins Raised Apart","27x3",2,27,3
"773","carData","Guyer","Anonymity and Cooperation","20x3",2,20,3
"774","carData","Mandel","Contrived Collinear Data","8x3",2,8,3
"775","carData","Robey","Fertility and Contraception","50x3",2,50,3
"776","carData","Transact","Transaction data","261x3",2,261,3
"777","colorspace","USSouthPolygon","Polygon for County Map of US South States: Alabama, Georgia, and South Carolina","4874x3",2,4874,3
"778","datasets","DNase","Elisa assay of DNase","176x3",2,176,3
"779","datasets","Indometh","Pharmacokinetics of Indomethacin","66x3",2,66,3
"780","datasets","Loblolly","Growth of Loblolly Pine Trees","84x3",2,84,3
"781","datasets","Orange","Growth of Orange Trees","35x3",2,35,3
"782","datasets","Puromycin","Reaction Velocity of an Enzymatic Reaction","23x3",2,23,3
"783","datasets","ToothGrowth","The Effect of Vitamin C on Tooth Growth in Guinea Pigs","60x3",2,60,3
"784","datasets","morley","Michelson Speed of Light Data","100x3",2,100,3
"785","datasets","randu","Random Numbers from Congruential Generator RANDU","400x3",2,400,3
"786","datasets","sleep","Student's Sleep Data","20x3",2,20,3
"787","datasets","trees","Diameter, Height and Volume for Black Cherry Trees","31x3",2,31,3
"788","datasets","warpbreaks","The Number of Breaks in Yarn during Weaving","54x3",2,54,3
"789","DiagrammeR","usd_exchange_rates","US Dollar exchange rates.","196x3",2,196,3
"790","DiceDesign","OA131","A 3D orthogonal array of strength 2","49x3",2,49,3
"791","DiceDesign","OA131_scrambled","A scrambled 3D orthogonal array of strength 2","49x3",2,49,3
"792","doBy","crickets","crickets data","30x3",2,30,3
"793","doBy","income","income data","80x3",2,80,3
"794","doBy","potatoes","Weight and size of 20 potatoes","20x3",2,20,3
"795","fivethirtyeight","democratic_bench","Some Democrats Who Could Step Up If Hillary Isn't Ready For Hillary","67x3",2,67,3
"796","fivethirtyeight","elasticity_by_district","Political Elasticity Scores","435x3",2,435,3
"797","fivethirtyeight","nfltix_div_avgprice","Who Goes To Meaningless NFL Games And Why?","108x3",2,108,3
"798","fivethirtyeight","nflwr_aging_curve","The Football Hall Of Fame Has A Receiver Problem","24x3",2,24,3
"799","fivethirtyeight","nutrition_pvalues","You Can't Trust What You Read About Nutrition","27716x3",2,27716,3
"800","fivethirtyeight","partisan_lean_state","FiveThirtyEight's Partisan Lean","50x3",2,50,3
"801","fivethirtyeight","trump_news","How Trump Hacked The Media","286x3",2,286,3
"802","fivethirtyeight","trump_twitter","The World's Favorite Donald Trump Tweets","448x3",2,448,3
"803","ggformula","MIpop","Population of Michigan counties","83x3",2,83,3
"804","ggplot2","faithfuld","2d density estimate of Old Faithful data","5625x3",2,5625,3
"805","ggraph","highschool","Friendship among high school boys","506x3",2,506,3
"806","lattice","ethanol","Engine exhaust fumes from burning ethanol","88x3",2,88,3
"807","lme4","Penicillin","Variation in penicillin testing","144x3",2,144,3
"808","lme4","sleepstudy","Reaction times in a sleep deprivation study","180x3",2,180,3
"809","MASS","Cushings","Diagnostic Tests on Patients with Cushing's Syndrome","27x3",2,27,3
"810","MASS","Rubber","Accelerated Testing of Tyre Rubber","30x3",2,30,3
"811","MASS","Skye","AFM Compositions of Aphyric Skye Lavas","23x3",2,23,3
"812","MASS","anorexia","Anorexia Data on Weight Change","72x3",2,72,3
"813","MASS","cats","Anatomical Data from Domestic Cats","144x3",2,144,3
"814","MASS","genotype","Rat Genotype Data","61x3",2,61,3
"815","MASS","hills","Record Times in Scottish Hill Races","35x3",2,35,3
"816","MASS","leuk","Survival Times and White Blood Counts for Leukaemia Patients","33x3",2,33,3
"817","MASS","menarche","Age of Menarche in Warsaw","25x3",2,25,3
"818","MASS","michelson","Michelson's Speed of Light Data","100x3",2,100,3
"819","MASS","motors","Accelerated Life Testing of Motorettes","40x3",2,40,3
"820","MASS","muscle","Effect of Calcium Chloride on Muscle Contraction in Rat Hearts","60x3",2,60,3
"821","MASS","stormer","The Stormer Viscometer Data","23x3",2,23,3
"822","MASS","synth.te","Synthetic Classification Problem","1000x3",2,1000,3
"823","MASS","synth.tr","Synthetic Classification Problem","250x3",2,250,3
"824","MASS","topo","Spatial Topographic Data","52x3",2,52,3
"825","MASS","whiteside","House Insulation: Whiteside's Data","56x3",2,56,3
"826","maxstat","hohnloser","Left ventricular ejection fraction of patients with malignant ventricular tachyarrhythmias.","94x3",2,94,3
"827","modeldata","Smithsonian","Smithsonian museums","20x3",2,20,3
"828","modeldata","crickets","Rates of Cricket Chirps","31x3",2,31,3
"829","modeldata","parabolic","Parabolic class boundary data","500x3",2,500,3
"830","modeldata","two_class_dat","Two class data","791x3",2,791,3
"831","ModelMetrics","testDF","Test data","100x3",2,100,3
"832","mosaic","Mustangs","Mustang Prices","25x3",2,25,3
"833","mosaicData","Alcohol","Alcohol Consumption per Capita","411x3",2,411,3
"834","mosaicData","Countries","Countries","288x3",2,288,3
"835","mosaicData","GoosePermits","Goose Permit Study","11x3",2,11,3
"836","mosaicData","SwimRecords","100 m Swimming World Records","62x3",2,62,3
"837","mosaicData","Whickham","Data from the Whickham survey","1314x3",2,1314,3
"838","nlme","Cefamandole","Pharmacokinetics of Cefamandole","84x3",2,84,3
"839","nlme","Fatigue","Cracks caused by metal fatigue","262x3",2,262,3
"840","nlme","IGF","Radioimmunoassay of IGF-I Protein","237x3",2,237,3
"841","nlme","Machines","Productivity Scores for Machines and Workers","54x3",2,54,3
"842","nlme","Muscle","Contraction of heart muscle sections","60x3",2,60,3
"843","nlme","Ovary","Counts of Ovarian Follicles","308x3",2,308,3
"844","nlme","Relaxin","Assay for Relaxin","198x3",2,198,3
"845","nlme","ergoStool","Ergometrics experiment with stool types","36x3",2,36,3
"846","openintro","arbuthnot","Male and female births in London","82x3",2,82,3
"847","openintro","ask","How important is it to ask pointed questions?","219x3",2,219,3
"848","openintro","bac","Beer and blood alcohol content","16x3",2,16,3
"849","openintro","cherry","Summary information for 31 cherry trees","31x3",2,31,3
"850","openintro","china","Child care hours","9788x3",2,9788,3
"851","openintro","coast_starlight","Coast Starlight Amtrak train","16x3",2,16,3
"852","openintro","elmhurst","Elmhurst College gift aid","50x3",2,50,3
"853","openintro","fact_opinion","Can Americans categorize facts and opinions?","5035x3",2,5035,3
"854","openintro","fish_age","Young fish in the North Sea.","300x3",2,300,3
"855","openintro","flow_rates","River flow data","31x3",2,31,3
"856","openintro","helium","Helium football","39x3",2,39,3
"857","openintro","law_resume","Gender, Socioeconomic Class, and Interview Invites","316x3",2,316,3
"858","openintro","lizard_run","Lizard speeds","48x3",2,48,3
"859","openintro","london_boroughs","London Borough Boundaries","45341x3",2,45341,3
"860","openintro","marathon","New York City Marathon Times (outdated)","59x3",2,59,3
"861","openintro","playing_cards","Table of Playing Cards in 52-Card Deck","52x3",2,52,3
"862","openintro","present","Birth counts","63x3",2,63,3
"863","openintro","res_demo_1","Simulated data for regression","100x3",2,100,3
"864","openintro","res_demo_2","Simulated data for regression","300x3",2,300,3
"865","openintro","rosling_responses","Sample Responses to Two Public Health Questions","278x3",2,278,3
"866","openintro","simpsons_paradox_covid","Simpson's Paradox: Covid","268166x3",2,268166,3
"867","openintro","simulated_scatter","Simulated data for sample scatterplots","2033x3",2,2033,3
"868","openintro","snowfall","Snowfall at Paradise, Mt. Rainier National Park","100x3",2,100,3
"869","openintro","solar","Energy Output From Two Solar Arrays in San Francisco","284x3",2,284,3
"870","openintro","speed_gender_height","Speed, gender, and height of 1325 students","1325x3",2,1325,3
"871","openintro","stem_cell","Embryonic stem cells to treat heart attack (in sheep)","18x3",2,18,3
"872","openintro","tourism","Turkey tourism","47x3",2,47,3
"873","openintro","ucb_admit","ucb_admit","4526x3",2,4526,3
"874","openintro","unempl","Annual unemployment since 1890","121x3",2,121,3
"875","plotly","hobbs","Hobbs data","300x3",2,300,3
"876","plotly","mic","Mic data","305x3",2,305,3
"877","plotly","wind","Wind data","32x3",2,32,3
"878","probably","segment_logistic","Image segmentation predictions","1010x3",2,1010,3
"879","probably","segment_naive_bayes","Image segmentation predictions","1010x3",2,1010,3
"880","RobStatTM","leuk.dat","Leukemia Data","33x3",2,33,3
"881","RobStatTM","skin","Skin data","39x3",2,39,3
"882","robustbase","delivery","Delivery Time Data","25x3",2,25,3
"883","robustbase","heart","Heart Catherization Data","12x3",2,12,3
"884","robustbase","phosphor","Phosphorus Content Data","18x3",2,18,3
"885","robustbase","vaso","Vaso Constriction Skin Data Set","39x3",2,39,3
"886","s2","s2_data_tbl_cities","Low-resolution world boundaries, timezones, and cities","243x3",2,243,3
"887","s2","s2_data_tbl_countries","Low-resolution world boundaries, timezones, and cities","177x3",2,177,3
"888","survival","tobin","Tobin's Tobit data","20x3",2,20,3
"889","survminer","BMT","Bone Marrow Transplant","35x3",2,35,3
"890","tidyr","fish_encounters","Fish encounters","114x3",2,114,3
"891","tidyr","population","World Health Organization TB data","4060x3",2,4060,3
"892","tidyr","table3","Example tabular representations","6x3",2,6,3
"893","tidyr","table4a","Example tabular representations","3x3",2,3,3
"894","tidyr","table4b","Example tabular representations","3x3",2,3,3
"895","timetk","m4_daily","Sample of 4 Daily Time Series Datasets from the M4 Competition","9743x3",2,9743,3
"896","timetk","m4_hourly","Sample of 4 Hourly Time Series Datasets from the M4 Competition","3060x3",2,3060,3
"897","timetk","m4_monthly","Sample of 4 Monthly Time Series Datasets from the M4 Competition","1574x3",2,1574,3
"898","timetk","m4_quarterly","Sample of 4 Quarterly Time Series Datasets from the M4 Competition","196x3",2,196,3
"899","timetk","m4_weekly","Sample of 4 Weekly Time Series Datasets from the M4 Competition","2295x3",2,2295,3
"900","timetk","m4_yearly","Sample of 4 Yearly Time Series Datasets from the M4 Competition","135x3",2,135,3
"901","timetk","wikipedia_traffic_daily","Sample Daily Time Series Data from the Web Traffic Forecasting (Wikipedia) Competition","5500x3",2,5500,3
"902","usdata","prez_pwr","Presidential Power.","365x3",2,365,3
"903","vcd","Hospital","Hospital data","3x3",2,3,3
"904","wk","wk_proj_crs_json","Common CRS Representations","13387x3",2,13387,3
"905","yardstick","lung_surv","Survival Analysis Results","228x3",2,228,3
"906","boot","bigcity","Population of U.S. Cities","49x2",2,49,2
"907","boot","calcium","Calcium Uptake Data","27x2",2,27,2
"908","boot","cav","Position of Muscle Caveolae","138x2",2,138,2
"909","boot","cd4","CD4 Counts for HIV-Positive Patients","20x2",2,20,2
"910","boot","city","Population of U.S. Cities","10x2",2,10,2
"911","boot","claridge","Genetic Links to Left-handedness","37x2",2,37,2
"912","boot","cloth","Number of Flaws in Cloth","32x2",2,32,2
"913","boot","co.transfer","Carbon Monoxide Transfer","7x2",2,7,2
"914","boot","dogs","Cardiac Data for Domestic Dogs","7x2",2,7,2
"915","boot","ducks","Behavioral and Plumage Characteristics of Hybrid Ducks","11x2",2,11,2
"916","boot","grav","Acceleration Due to Gravity","26x2",2,26,2
"917","boot","gravity","Acceleration Due to Gravity","81x2",2,81,2
"918","boot","polar","Pole Positions of New Caledonian Laterites","50x2",2,50,2
"919","boot","survival","Survival of Rats after Radiation Doses","14x2",2,14,2
"920","boot","tau","Tau Particle Decay Modes","60x2",2,60,2
"921","carData","CanPop","Canadian Population Data","16x2",2,16,2
"922","carData","Friendly","Format Effects on Recall","30x2",2,30,2
"923","carData","Sahlins","Agricultural Production in Mazulu Village","20x2",2,20,2
"924","carData","USPop","Population of the United States","22x2",2,22,2
"925","cluster","agriculture","European Union Agricultural Workforces","12x2",2,12,2
"926","cluster","ruspini","Ruspini Data","75x2",2,75,2
"927","cluster","xclara","Bivariate Data Set with 3 Clusters","3000x2",2,3000,2
"928","datasets","BOD","Biochemical Oxygen Demand","6x2",2,6,2
"929","datasets","Formaldehyde","Determination of Formaldehyde","6x2",2,6,2
"930","datasets","InsectSprays","Effectiveness of Insect Sprays","72x2",2,72,2
"931","datasets","PlantGrowth","Results from an Experiment on Plant Growth","30x2",2,30,2
"932","datasets","Titanic","Survival of passengers on the Titanic","4x2x2x2",4,4,2
"933","datasets","UCBAdmissions","Student Admissions at UC Berkeley","2x2x6",3,2,2
"934","datasets","cars","Speed and Stopping Distances of Cars","50x2",2,50,2
"935","datasets","chickwts","Chicken Weights by Feed Type","71x2",2,71,2
"936","datasets","faithful","Old Faithful Geyser Data","272x2",2,272,2
"937","datasets","pressure","Vapor Pressure of Mercury as a Function of Temperature","19x2",2,19,2
"938","datasets","women","Average Heights and Weights for American Women","15x2",2,15,2
"939","DiagrammeR","edge_list_1","Edge list - Version 1.","19x2",2,19,2
"940","DiagrammeR","node_list_1","Node list - Version 1.","10x2",2,10,2
"941","doBy","math_teachers","Height of math teachers","30x2",2,30,2
"942","dplyr","band_instruments","Band membership","3x2",2,3,2
"943","dplyr","band_instruments2","Band membership","3x2",2,3,2
"944","dplyr","band_members","Band membership","3x2",2,3,2
