"","Package","Item","Title","Dim","dim","nrow","ncol"
"945","fivethirtyeight","cousin_marriage","How Many Americans Are Married To Their Cousins?","70x2",2,70,2
"946","fivethirtyeight","elasticity_by_state","Political Elasticity Scores","51x2",2,51,2
"947","fivethirtyeight","male_flight_attend","Dear Mona, How Many Flight Attendants Are Men?","320x2",2,320,2
"948","fivethirtyeight","mediacloud_online_news","The Media Really Started Paying Attention to Puerto Rico When Trump Did","49x2",2,49,2
"949","fivethirtyeight","nba_tattoos","Accurately Counting NBA Tattoos Isn't Easy, Even If You're Up Close","636x2",2,636,2
"950","fivethirtyeight","nfltix_usa_avg","Who Goes To Meaningless NFL Games And Why?","32x2",2,32,2
"951","fivethirtyeight","riddler_pick_lowest","Pick A Number, Any Number","3660x2",2,3660,2
"952","fivethirtyeight","tennis_players_time","Why Some Tennis Matches Take Forever","218x2",2,218,2
"953","ggpubr","gene_citation","Gene Citation Index","66x2",2,66,2
"954","lattice","melanoma","Melanoma skin cancer incidence","37x2",2,37,2
"955","lattice","singer","Heights of New York Choral Society singers","235x2",2,235,2
"956","lme4","Dyestuff","Yield of dyestuff by batch","30x2",2,30,2
"957","lme4","Dyestuff2","Yield of dyestuff by batch","30x2",2,30,2
"958","lmtest","ChickEgg","Chickens, Eggs, and Causality","54x2",2,54,2
"959","lmtest","Mandible","Mandible Data","167x2",2,167,2
"960","lmtest","USDistLag","US Macroeconomic Data","20x2",2,20,2
"961","lmtest","growthofmoney","Growth of Money Supply","19x2",2,19,2
"962","MASS","Animals","Brain and Body Weights for 28 Species","28x2",2,28,2
"963","MASS","GAGurine","Level of GAG in Urine of Children","314x2",2,314,2
"964","MASS","forbes","Forbes' Data on Boiling Points in the Alps","17x2",2,17,2
"965","MASS","geyser","Old Faithful Geyser Data","299x2",2,299,2
"966","MASS","mammals","Brain and Body Weights for 62 Species of Land Mammals","62x2",2,62,2
"967","MASS","mcycle","Data from a Simulated Motorcycle Accident","133x2",2,133,2
"968","MASS","steam","The Saturated Steam Pressure Data","14x2",2,14,2
"969","MASS","wtloss","Weight Loss Data from an Obese Patient","52x2",2,52,2
"970","maxstat","treepipit","Tree Pipit Data","86x2",2,86,2
"971","modeldata","drinks","Sample time series data","309x2",2,309,2
"972","modeldata","pathology","Liver pathology data","344x2",2,344,2
"973","modeldata","solubility_test","Solubility predictions from MARS model","316x2",2,316,2
"974","modelr","sim1","Simple simulated datasets","30x2",2,30,2
"975","modelr","sim2","Simple simulated datasets","40x2",2,40,2
"976","mosaic","Sleep","Sleep and Memory","24x2",2,24,2
"977","mosaicData","CoolingWater","CoolingWater","222x2",2,222,2
"978","mosaicData","Dimes","Weight of dimes","30x2",2,30,2
"979","mosaicData","Mites","Mites and Wilt Disease","47x2",2,47,2
"980","NACCdata","udsGroups","Groupings for Variables in UDS This is a helper dataset that includes the 'Form' value for variables listed in the UDS's data dictionary. When a value is not available, the variable is set to 'No_Group'.","1943x2",2,1943,2
"981","nlme","Rail","Evaluation of Stress in Railway Rails","18x2",2,18,2
"982","openintro","assortative_mating","Eye color of couples","204x2",2,204,2
"983","openintro","assortive_mating","Eye color of couples","204x2",2,204,2
"984","openintro","avandia","Cardiovascular problems for two types of Diabetes medicines","227571x2",2,227571,2
"985","openintro","biontech_adolescents","Efficacy of Pfizer-BioNTech COVID-19 vaccine on adolescents","2260x2",2,2260,2
"986","openintro","books","Sample of books on a shelf","95x2",2,95,2
"987","openintro","burger","Burger preferences","500x2",2,500,2
"988","openintro","cancer_in_dogs","Cancer in dogs","1436x2",2,1436,2
"989","openintro","classdata","Simulated class data","164x2",2,164,2
"990","openintro","cpr","CPR dataset","90x2",2,90,2
"991","openintro","diabetes2","Type 2 Diabetes Clinical Trial for Patients 10-17 Years Old","699x2",2,699,2
"992","openintro","dream","Survey on views of the DREAM Act","910x2",2,910,2
"993","openintro","drone_blades","Quadcopter Drone Blades","2000x2",2,2000,2
"994","openintro","drug_use","Drug use of students and parents","445x2",2,445,2
"995","openintro","ethanol","Ethanol Treatment for Tumors Experiment","24x2",2,24,2
"996","openintro","family_college","Simulated sample of parent / teen college attendance","792x2",2,792,2
"997","openintro","fcid","Summary of male heights from USDA Food Commodity Intake Database","100x2",2,100,2
"998","openintro","full_body_scan","Poll about use of full-body airport scanners","1137x2",2,1137,2
"999","openintro","gear_company","Fake data for a gear company example","2000x2",2,2000,2
"1000","openintro","gender_discrimination","Bank manager recommendations based on gender","48x2",2,48,2
"1001","openintro","global_warming_pew","Pew survey on global warming","2253x2",2,2253,2
"1002","openintro","gov_poll","Pew Research poll on government approval ratings","4223x2",2,4223,2
"1003","openintro","gpa_study_hours","gpa_study_hours","193x2",2,193,2
"1004","openintro","gradestv","Simulated data for analyzing the relationship between watching TV and grades","25x2",2,25,2
"1005","openintro","gsearch","Simulated Google search experiment","10000x2",2,10000,2
"1006","openintro","gss_wordsum_class","gss_wordsum_class","795x2",2,795,2
"1007","openintro","health_coverage","Health Coverage and Health Status","20000x2",2,20000,2
"1008","openintro","healthcare_law_survey","Pew Research Center poll on health care, including question variants","1503x2",2,1503,2
"1009","openintro","helmet","Socioeconomic status and reduced-fee school lunches","12x2",2,12,2
"1010","openintro","immigration","Poll on illegal workers in the US","910x2",2,910,2
"1011","openintro","infmortrate","Infant Mortality Rates, 2012","222x2",2,222,2
"1012","openintro","lizard_habitat","Field data on lizards observed in their natural habitat","332x2",2,332,2
"1013","openintro","major_survey","Survey of Duke students and the area of their major","218x2",2,218,2
"1014","openintro","malaria","Malaria Vaccine Trial","20x2",2,20,2
"1015","openintro","mammogram","Experiment with Mammogram Randomized","89835x2",2,89835,2
"1016","openintro","migraine","Migraines and acupuncture","89x2",2,89,2
"1017","openintro","offshore_drilling","California poll on drilling off the California coast","828x2",2,828,2
"1018","openintro","opportunity_cost","Opportunity cost of purchases","150x2",2,150,2
"1019","openintro","penetrating_oil","What's the best way to loosen a rusty bolt?","30x2",2,30,2
"1020","openintro","penny_ages","Penny Ages","648x2",2,648,2
"1021","openintro","photo_classify","Photo classifications: fashion or not","1822x2",2,1822,2
"1022","openintro","ppp_201503","US Poll on who it is better to raise taxes on","691x2",2,691,2
"1023","openintro","race_justice","Yahoo! News Race and Justice poll results","1059x2",2,1059,2
"1024","openintro","salinity","Salinity in Bimini Lagoon, Bahamas","30x2",2,30,2
"1025","openintro","sex_discrimination","Bank manager recommendations based on sex","48x2",2,48,2
"1026","openintro","sinusitis","Sinusitis and antibiotic experiment","166x2",2,166,2
"1027","openintro","sleep_deprivation","Survey on sleep deprivation and transportation workers","1087x2",2,1087,2
"1028","openintro","smallpox","Smallpox vaccine results","6224x2",2,6224,2
"1029","openintro","socialexp","Social experiment","45x2",2,45,2
"1030","openintro","soda","soda","60x2",2,60,2
"1031","openintro","stent30","Stents for the treatment of stroke","451x2",2,451,2
"1032","openintro","stent365","Stents for the treatment of stroke","451x2",2,451,2
"1033","openintro","sulphinpyrazone","Treating heart attacks","1475x2",2,1475,2
"1034","openintro","toy_anova","Simulated dataset for ANOVA","140x2",2,140,2
"1035","openintro","twins","twins","27x2",2,27,2
"1036","openintro","winery_cars","Time Between Gondola Cars at Sterling Winery","52x2",2,52,2
"1037","openintro","yawn","Contagiousness of yawning","50x2",2,50,2
"1038","padr","coffee","Coffee Data Set","4x2",2,4,2
"1039","PerformanceAnalytics","portfolio_bacon","Bacon(2008) Data","24x2",2,24,2
"1040","RobStatTM","biochem","Biochem data","12x2",2,12,2
"1041","RobStatTM","mineral","Mineral data","53x2",2,53,2
"1042","RobStatTM","shock","Shock data","16x2",2,16,2
"1043","robustbase","Animals2","Brain and Body Weights for 65 Species of Land Animals","65x2",2,65,2
"1044","robustbase","SiegelsEx","Siegel's Exact Fit Example Data","9x2",2,9,2
"1045","robustbase","cloud","Cloud point of a Liquid","19x2",2,19,2
"1046","robustbase","condroz","Condroz Data","428x2",2,428,2
"1047","robustbase","exAM","Example Data of Antille and May - for Simple Regression","12x2",2,12,2
"1048","robustbase","kootenay","Waterflow Measurements of Kootenay River in Libby and Newgate","13x2",2,13,2
"1049","robustbase","lactic","Lactic Acid Concentration Measurement Data","20x2",2,20,2
"1050","robustbase","pension","Pension Funds Data","18x2",2,18,2
"1051","robustbase","pilot","Pilot-Plant Data","20x2",2,20,2
"1052","robustbase","starsCYG","Hertzsprung-Russell Diagram Data of Star Cluster CYG OB1","47x2",2,47,2
"1053","robustbase","telef","Number of International Calls from Belgium","24x2",2,24,2
"1054","s2","s2_data_tbl_timezones","Low-resolution world boundaries, timezones, and cities","120x2",2,120,2
"1055","timetk","taylor_30_min","Half-hourly electricity demand","4032x2",2,4032,2
"1056","vcd","CoalMiners","Breathlessness and Wheeze in Coal Miners","2x2x9",3,2,2
"1057","vcd","PreSex","Pre-marital Sex and Divorce","2x2x2x2",4,2,2
"1058","vcd","Rochdale","Rochdale Data","2x2x2x2x2x2x2x2",8,2,2
"1059","yardstick","pathology","Liver Pathology Data","344x2",2,344,2
"1060","yardstick","solubility_test","Solubility Predictions from MARS Model","316x2",2,316,2
"1061","boot","aircondit","Failures of Air-conditioning Equipment","12x1",2,12,1
"1062","boot","aircondit7","Failures of Air-conditioning Equipment","24x1",2,24,1
"1063","boot","capability","Simulated Manufacturing Process Data","75x1",2,75,1
"1064","boot","coal","Dates of Coal Mining Disasters","191x1",2,191,1
"1065","boot","darwin","Darwin's Plant Height Differences","15x1",2,15,1
"1066","boot","islay","Jura Quartzite Azimuths on Islay","18x1",2,18,1
"1067","boot","paulsen","Neurotransmission in Guinea Pig Brains","346x1",2,346,1
"1068","boot","tuna","Tuna Sighting Data","64x1",2,64,1
"1069","modeldata","covers","Raw cover type data","40x1",2,40,1
"1070","openintro","age_at_mar","Age at first marriage of 5,534 US women.","5534x1",2,5534,1
"1071","openintro","ami_occurrences","Acute Myocardial Infarction (Heart Attack) Events","365x1",2,365,1
"1072","openintro","antibiotics","Pre-existing conditions in 92 children","92x1",2,92,1
"1073","openintro","ball_bearing","Lifespan of ball bearings","75x1",2,75,1
"1074","openintro","cchousing","Community college housing (simulated data)","75x1",2,75,1
"1075","openintro","credits","College credits.","100x1",2,100,1
"1076","openintro","ebola_survey","Survey on Ebola quarantine","1042x1",2,1042,1
"1077","openintro","env_regulation","American Adults on Regulation and Renewable Energy","705x1",2,705,1
"1078","openintro","exams","Exam scores","19x1",2,19,1
"1079","openintro","exclusive_relationship","Number of Exclusive Relationships","218x1",2,218,1
"1080","openintro","fheights","Female college student heights, in inches","24x1",2,24,1
"1081","openintro","housing","Simulated dataset on student housing","75x1",2,75,1
"1082","openintro","ipod","Length of songs on an iPod","3000x1",2,3000,1
"1083","openintro","jury","Simulated juror dataset","275x1",2,275,1
"1084","openintro","leg_mari","Legalization of Marijuana Support in 2010 California Survey","119x1",2,119,1
"1085","openintro","male_heights","Sample of 100 male heights","100x1",2,100,1
"1086","openintro","male_heights_fcid","Random sample of adult male heights","100x1",2,100,1
"1087","openintro","manhattan","manhattan","20x1",2,20,1
"1088","openintro","nuclear_survey","Nuclear Arms Reduction Survey","1028x1",2,1028,1
"1089","openintro","penelope","Guesses at the weight of Penelope (a cow)","17184x1",2,17184,1
"1090","openintro","poker","Poker winnings during 50 sessions","50x1",2,50,1
"1091","openintro","russian_influence_on_us_election_2016","Russians' Opinions on US Election Influence in 2016","506x1",2,506,1
"1092","openintro","sat_improve","Simulated data for SAT score improvement","30x1",2,30,1
"1093","openintro","scotus_healthcare","Public Opinion with SCOTUS ruling on American Healthcare Act","1012x1",2,1012,1
"1094","openintro","sp500_seq","S&P 500 stock data","2948x1",2,2948,1
"1095","openintro","stats_scores","Final exam scores for twenty students","20x1",2,20,1
"1096","openintro","student_housing","Community college housing (simulated data, 2015)","175x1",2,175,1
"1097","openintro","student_sleep","Sleep for 110 students (simulated)","110x1",2,110,1
"1098","openintro","supreme_court","Supreme Court approval rating","976x1",2,976,1
"1099","openintro","thanksgiving_spend","Thanksgiving spending, simulated based on Gallup poll.","436x1",2,436,1
"1100","openintro","toohey","Simulated polling dataset","500x1",2,500,1
"1101","openintro","transplant","Transplant consultant success rate (fake data)","62x1",2,62,1
"1102","PerformanceAnalytics","prices","Selected Price Series Example Data","2011x1",2,2011,1
"1103","RobStatTM","flour","Flour data","24x1",2,24,1
